Job Location,Title,Company,Description
Canada,Developpeur.se junior - Junior Developer,LIDD Consultants,"À propos de LIDD

LIDD est une firme d’experts-conseils de premier plan en matiere de chaîne d’approvisionnement. Nous offrons nos services partout en Amerique du Nord ainsi qu’en Asie. Nous concevons de grands entrepets et des systemes logistiques complexes afin d’aider nos clients à faire circuler leurs marchandises plus efficacement. Nos clients sont des manufacturiers, distributeurs et detaillants dont certains sont de grandes marques dans les industries alimentaires et des biens à la consommation. Notre equipe grandissante de consultants, d’analystes, de concepteurs et de programmeurs opere depuis nos bureaux à Montreal, Toronto, Los Angeles et Seoul.




Notre declaration sur la diversite

LIDD est un employeur qui respecte l'egalite des chances. En rejoignant notre equipe, vous vous sentirez à votre place, quels que soient votre ethnie, religion, couleur de peau, origine, sexe, orientation sexuelle, âge, etat civil ou handicap. Faites-nous savoir si vous avez besoin d’accommodements durant le processus de recrutement.




Quel est votre rele?

Notre Developpeur.se Junior Solochain doit agir comme un.e conseiller.ere aupres de nos clients.es sur les decisions technologiques qu'ils doivent prendre, en fournissant une vision sur le rele de chaque systeme et en indiquant où les investissements sont necessaires en:

Developpant des ameliorations aux plateformes existantes;
Enquêter sur les problemes techniques et corriger les erreurs;
En menant à terme des projets d’integration.

Les principales tâches et responsabilites, sans être limitees à celles-ci, sont les suivantes:

Soutenir la mise en œuvre de technologies dans le cadre d'un nouveau deploiement et de projets d'amelioration continue;
Maintenir et optimiser une importante base de code existante dans un environnement d'equipe;
Examiner les tickets avec les membres de l'equipe pour evaluation et resolution;
Utiliser les normes de l'industrie pour apporter des personnalisations aux systemes conformement aux meilleures pratiques;
Faciliter l'attribution et le suivi des tâches par application et processus dans le respect des directives SLA, selon les besoins;
Resoudre les problemes de production, maintenir une communication efficace avec la direction technique-architecte et l'equipe immediate;
Analyser la source des problemes, reperer les tendances et recommander des mesures qui minimiseront ou elimineront les occurrences futures;
Collaborer avec des collegues pour rechercher des problemes et trouver des solutions;
Mettre en œuvre, tester et corriger les solutions logicielles.




Exigences - Pour être qualifie.e pour ce rele, vous avez:

Habiter à Montreal, QC
Dipleme d'associe ou de Baccalaureat en informatique et logiciels, technologie de l'information, gestion de la chaîne d'approvisionnement, genie industriel, distribution OU domaine connexe;
Experience avec Java et SQL;
Comprehension de divers processus et pratiques commerciales de la chaîne d'approvisionnement;
Comprehension fondamentale du cycle de vie du developpement de logiciels et des techniques d'assurance de la qualite à l'aide de referentiels de contrele du code source, experience du debogage et des tests;
Excellent anglais et français ecrit et parle.

Considere comme un atout:

Experience du deploiement-de la mise en service d'applications de distribution à grande echelle.
Connaissance des pratiques de gestion des bases de donnees.
Connaissance des transactions de services Web, SOAP et REST.

Nous recherchons des candidats.es qui ont:

Une capacite à bien travailler sous pression au sein d'une equipe;
Capacite à determiner les exigences du projet;
De fortes capacites de resolution de problemes;
Un souci du detail et de la qualite;
Capacite à gerer plusieurs tâches simultanement avec un encadrement limite;
Capacite à travailler de maniere independante dans un environnement ambigu avec des delais serres.




Avantages - Votre salaire et vos avantages:

Salaire selon l'experience;
3 semaines de conges payes;
Prime annuelle;
Regime collectif d'assurance maladie et d'assurance vie des la premiere journee;
Horaire flexible et possibilite de travailler à distance;
Subvention de formation et excellentes possibilites de developpement professionnel;
Prime de referencement;
Bureaux modernes avec boissons et collations gratuites;
Évenements sociaux d'entreprise;
Culture exceptionnelle incluant la collaboration avec des collegues à travers les six bureaux de l'entreprise.




____________




About LIDD

LIDD (LIDD.com) is a leading supply chain management consulting firm. We design complex warehouses and logistics systems to help companies move goods more efficiently. Our clients are manufacturers, distributors and retailers, including many brand names in food & beverage and consumer goods. From our offices in Montreal, Toronto, Los Angeles and Seoul, we tackle challenging projects in a fun and supportive environment.




Our Diversity Statement

LIDD is an equal opportunity employer. When you join our team, you'll feel like you belong regardless of your ethnicity, religion, race, origin, gender, sexual orientation, age, marital status or disability. Let us know if you need accommodation during the recruitment process.




Donnee

What’s your role:

Our Junior Solochain Developer will act as an advisor to our clients on the technological decisions they need to make, providing insight on the role of each system and where investments are needed by:

Developing enhancements to existing platforms;
Investigating technical issues and correcting errors;
Completing integration projects.




Day-to-day you will:

Support the implementation of technologies as part of a new deployment and continuous improvement projects.
Configure, maintain and support existing installations of our WMS software solutions.
Work alongside a team to encode project requirements into computer language.
Maintain and optimize large existing codebase in a team based environment.
Review tickets with team members for assessment and resolution;
Use industry standards to make customizations to systems in accordance with best practices;
Facilitate task assignment and monitoring by application and process within SLA guidelines, as needed;
Resolve production issues, maintain effective communication with technical leadership-architect, immediate team and management;
Analyze the source of problems, locating trends, and recommending measures that will minimize or eliminate future occurrences;
Partner with co-workers to research problems and find solutions; participate in diagnostic procedures;
Implement, test and correct software solutions.




Requirements

To qualify for this role, you’ll need:

Live in Montreal, QC
Associate or bachelor’s degree in development, information technology, supply chain management, industrial engineering, distribution or related field
Really good understanding of JAVA and SQL.
Being operational process oriented and customer oriented.
Core understanding of the software development lifecycle and of Quality Assurance techniques using source code control repositories, debugging and testing experience.
Excellent written and spoken French and English

Considered a plus:

Experience in deployment-go-live of large-scale distribution applications
Experience with business software for operations (ERP, WMS, TMS, MES)

We’re looking for candidates who have:

Interest in supply chain management, logistics and distribution operations
Ability to work well under pressure within a team
Ability to determine project requirements
Strong problem-solving capabilities
Superior verbal and written communication and presentation skills
Attention to detail and quality
Ability to handle multiple assignments simultaneously with limited guidance
Comfort working independently in an ambiguous environment with pressing deadlines




Benefits

Your salary & benefits:

Salary depending on experience;
3 weeks of paid vacation;
Annual bonus;
Group health and life insurance plan from day 1;
Flexible schedule and some remote work;
Training grants and excellent professional development opportunities;
Referral bonus program;
New, modern offices with free drinks and snacks;
Company parties and events;
Outstanding culture allowing you to collaborate with colleagues across six corporate offices.
Mostrar más"
Canada,Software Developer - Developpeur logiciel - C#-C++,Genetec,"The team:

The Video ecosystem group is responsible for providing business critical integrations and features from our camera partners to Genetec products.

As a Software Developer, you will have the opportunity to work with numerous partners offering many features available through their devices, assisting in the resolution of issues, and improving the user experience. You will take part in the analysis, design, and implementation of tasks, completing the required use cases.

In line with our collaborative culture, we rely on peer review for knowledge transfer, personal improvements and quality control. You will also participate in daily meetings to synchronize work, share updates of your progress and blockers and collaborate closely with other developers to build solutions to significant problems.

What your day will look like:

Design and write code for object-oriented distributed applications using the Windows platform and Microsoft Visual Studio
Design and build new functionalities in a microservices environment using Azure DevOps, Docker and .NET core
Participate in the design of different features and service APIs
Work with several camera models and IP encoders to leverage their functionalities (video-audio-metadata configuration and monitoring, reception and parsing of events, PTZ commands and control, etc.) based on the manufacturer’s API (TCP, HTTP, SOAP, REST-JSON, etc.)
Work in conjunction with our different partners across the globe


Here’s a sneak peek of the technologies we’re using:

C#, .NET core
C++, C++-CLI
Linux and Windows
Visual Studio 2022 and ReSharper
Docker
Wireshark


About you:

Bachelor’s degree in Computer Engineering, Software Engineering or Computer Sciences (or equivalent)
Experience in C++ or C# (the two languages are used in the team depending on the integration architecture and platform)
Strong knowledge of object-oriented programming
Knowledge of Unit testing, Test-Driven Development (TDD) and-or User Acceptance Tests (UAT)
Knowledge of networking (TCP-IP, UDP)


Let's talk perks!

Attractive compensation package
Training Tuition Reimbursement Program
Mature Agile environment
Work-life balance with a flexible working schedule
Free, unlimited coffee
Free parking for all employees and-or reimbursement on public transport
Virtual exercise classes- discounts on your gym membership


Would you like to know what it looks like to work at Genetec? Click on the following link to find out for yourself! Genetec Culture

Please note that only qualified candidates will be contacted for an interview. Head-hunters and recruitment agencies may not submit resumes-CVs through this Web site or directly to managers.

L'equipe :

L’equipe Écosysteme video est chargee d’integrer aux produits Genetec des integrations et des fonctionnalites essentielles pour l’entreprise que nous fournissent nos partenaires de l’industrie des cameras.

En tant que Developpeur logiciel, vous aurez l’occasion de travailler avec plusieurs partenaires de Genetec afin de leur fournir differentes fonctionnalites pour leurs appareils et de contribuer à la resolution de problemes et à l’amelioration de l’experience utilisateur. Vous participerez à l’analyse, à la conception et à la mise en place de differentes fonctionnalites tout en effectuant les cas d’utilisation requis.

Chez Genetec, le transfert de connaissances, le perfectionnement professionnel et le contrele de la qualite sont assures au moyen d’evaluations par des pairs, conformement à notre culture de collaboration. Vous participerez à des reunions quotidiennes de coordination des tâches, vous ferez le point sur vos progres et vos difficultes et vous collaborerez etroitement avec d’autres specialistes en developpement logiciel pour trouver des solutions à des problemes importants.

À quoi ressemblera votre journee :

Concevoir et ecrire du code pour des applications distribuees orientees objet en utilisant la plateforme Windows et Microsoft Visual Studio
Concevoir et developper de nouvelles fonctionnalites dans un environnement de microservices en utilisant Azure DevOps, Docker et .NET core
Participer à la conception de differentes fonctionnalites et API de services
Travailler avec differents modeles de cameras et d’encodeurs IP afin de maximiser leurs fonctionnalites (configuration et surveillance de la video, de l’audio et des metadonnees, reception et analyse des evenements, commandes et contrele du dispositif VPIZ, etc.) en se basant sur l’API du fabricant (TCP, HTTP, SOAP, REST-JSON, etc.)
Travailler en collaboration avec nos differents partenaires dans le monde


Voici un aperçu des technologies que nous utilisons :

C#, .NET core
C++, C++-CLI
Linux et Windows
Visual Studio 2022 et ReSharper
Docker
Wireshark


Votre profil :

Baccalaureat en genie informatique, en genie logiciel ou en sciences informatiques
Experience en C++ ou C# (l’equipe utilise les deux langages en fonction de l’architecture et de la plateforme d’integration)
Connaissance approfondie de la programmation orientee-objet
Connaissance des tests unitaires, du developpement base sur les tests et-ou des essais d’acceptation par l’utilisateur
Connaissance du reseautage (TCP-IP, UDP)


Voilà ce que nous offrons !

Regime de remuneration attrayant
Programme de remboursement des frais de formation
Environnement avec bon niveau de maturite Agile
Équilibre entre vie professionnelle et vie privee grâce à un horaire de travail flexible
Cafe gratuit à volonte
Espace de stationnement gratuit et-ou remboursement du transport en commun
Des cours d'exercices virtuels- rabais sur l’abonnement au gym


Si vous souhaitez savoir à quoi ressemble l’environnement de travil chez Genetec, voici le lien vers notre video d’entreprise : Culture à Genetec

Merci pour votre candidature, mais veuillez noter que seul(e)s les candidat(e)s qualifie(e)s seront contacte(e)s. Les chasseurs de têtes et les agences de recrutement ne sont pas autorises à soumettre des CV par l'intermediaire de ce site web ou directement aux gestionnaires.
और दिखाएं"
Canada,Developpeur Fullstack,LEDUConseils,"Notre client est une entreprise qui developpe une solution innovante qui permet aux distributeurs de denrees alimentaires de reduire significativement leur empreinte ecologique. Pour poursuivre son ambitieux projet, elle desire completer son equipe actuelle en embauchant un-e Developpeur-euse Fullstack d’experience pour qui l’innovation represente un element essentiel dans un contexte professionnel. Le teletravail est inscrit dans l’ADN de l’entreprise depuis quelques annees dejà!

Fonctions

Contribuer à toutes les phases du cycle de developpement dans un contexte Agile.
Participer à l’application des meilleures pratiques en matiere de developpement Fullstack.
Developper un code performant respectueux de grandes contraintes de securite.
Élaborer et realiser les differentes strategies aux essais.
Collaborer etroitement avec des collegues d’autres secteurs pour assurer le succes du projet.

Competences

Baccalaureat dans le domaine des TI ou l’equivalent
Cinq annees d’experience en developpement Web (Fullstack)
Maîtrise de technologies telles React, PosgreSQL et AWS
Experience en environnement Agile
Mostrar mas"
Canada,.NET Software Developer - Developpeur logiciel .NET,Genetec,"The team:

We are looking for Developers with varied levels of experience - whether you are a talented newcomer to the workforce or a seasoned professional, you’ll find your place in one of our teams:

Access Control (Synergis)
Cloud Computing (Clearance-ClearID-Stratocast-GenetecOne)
Incident Management System (Mission Control)
Video Management System (Omnicast)
License Plate Recognition (AutoVu)
Core Platform (Security Center)
Enterprise Unification System
R&D Infrastructure & Connected Services
Device Integration


Of course, these teams may not be familiar to you now, but it would be our pleasure to speak with you and find the best fit for your profile, ambitions and skill set!

Top reasons why you want this job:

Because you like the idea of working on all aspects of the development
Because you want to use a unique blend of technical skill and creativity to develop powerful, efficient solutions for a highly scalable distributed enterprise level software system
Because you want to use your unique mix of software development skill and creativity to build new features on a world class software system
Because you’re interested in contributing to architectural-level decision making


What your day will look like:

Working from Front-End to Back-End components of the product using just about every major technology in the .NET framework
Building and maintaining fault tolerant architectures that stay responsive and scale in the face of a host of events and user interactions in a hybrid cloud context
Participating in everything in the development lifecycle including user experience, design, development and maintenance


About you:

A bachelor’s degree in Computer Engineering, Software Engineering or Computer Science, or equivalent experience
Open to all levels of experience, from junior to senior
Motivated to work in a fast-paced environment and enjoys the challenge of unfamiliar tasks


Technical Requirements:

Knowledge of programming in .NET
Experience with Visual Studio and basic concepts of software development (version management, code analysis, unit testing)


Let’s talk perks!

Attractive compensation package
Training Tuition Reimbursement Program
Subsidized meals in our amazing Bistro (Les Cordons Bleus)
Work-life balance with a flexible working schedule
Free, unlimited coffee
Private, free parking for all employees
Onsite fitness facility with personal trainer


Would you like to know what it looks like to work at Genetec? Click on the following link to find out for yourself! Genetec Culture

Thank you for your application, but please note that only qualified candidates will be contacted. Head-hunters and recruitment agencies may not submit resumes-CVs through this Web site or directly to managers.

L’equipe :

Nous sommes à la recherche de Developpeurs de differents niveaux d’experience. Que vous soyez un nouveau venu talentueux sur le marche du travail ou un professionnel chevronne, vous trouverez votre place au sein de l’une de nos equipes :

Controle d'acces (Synergis)
Cloud Computing (Clearance-ClearID-Stratocast-GenetecOne)
Systeme de gestion des incidents (Mission Control)
Systeme de gestion video (Omnicast)
Reconnaissance de plaques d'immatriculation (AutoVu)
Plateforme Core (Security Center)
Systeme d’unification des donnees d’entreprise
Infrastructure de R et D et services de connectivite
Integration de dispositifs


Certes, ces equipes ne vous sont peut-être pas familieres pour le moment, mais nous serions ravis de nous entretenir avec vous pour trouver celle qui correspond le mieux à votre profil, à vos ambitions et à vos competences.

Voici les principales raisons pour lesquelles vous voudrez occuper ce poste :

Parce que vous êtes enthousiaste à l’idee de travailler sur tous les aspects du developpement
Parce que vous desirez mettre à profit un melange unique de competences techniques et de creativite pour concevoir des solutions puissantes et efficaces destinees à un systeme logiciel d'entreprise distribue et hautement extensible
Parce que vous souhaitez deployer votre propre combinaison unique de creativite et de competences en developpement de logiciels pour concevoir les nouvelles fonctions d'un systeme de calibre mondia
Parce que vous souhaitez participer à la prise de decision au niveau architectural


À quoi ressemblera votre journee :

Il s'agit de travailler sur les composants FrontEnd et BackEnd du produit en utilisant toutes les technologies principales du Framework .NET
Cette fonction comprend la creation et la maintenance d'architectures d’envergure
Il faut travailler avec les langages fonctionnels et imperatifs (nous utilisons les langages C# et F#, et OUI, nous sommes prêts à vous les enseigner)
Cela consiste à contribuer à l'ensemble du cycle de developpement, y compris l'experience utilisateur, la conception, le developpement et la maintenance


Votre profil :

Vous detenez un baccalaureat en genie informatique, en genie logiciel ou en informatique, ou une experience equivalente
Vous êtes ouvert à l’idee d’occuper un poste correspondant à votre experience, qu’il s’agisse d’un poste de niveau debutant, intermediaire ou superieur
Vous êtes enthousiaste à l’idee de travailler dans un environnement où les activites se deroulent à un rythme rapide et vous aimez relever les defis associes aux tâches inhabituelles


Expertise technique :

Connaissance approfondie de la programmation dans l'environnement .NET
Experience avec Visual Studio et connaissance des concepts de base en matiere de developpement de logiciels (gestion de versions, analyse de code, essai unitaire)


Voilà ce que nous offrons !

Regime de remuneration attrayant
Programme de remboursement des frais de formation
Repas subventionnes à notre incroyable Bistro (Les Cordons Bleus)
Équilibre entre vie professionnelle et vie privee grâce à un horaire de travail flexible
Cafe gratuit à volonte
Espace de stationnement gratuit pour tous les employes
Centre d’entraînement sur place


Si vous souhaitez savoir à quoi ressemble l’environnement de travail chez Genetec, voici le lien vers notre video d’entreprise : Culture à Genetec

Merci pour votre candidature, mais veuillez noter que seul(e)s les candidat(e)s qualifie(e)s seront contacte(e)s. Les chasseurs de têtes et les agences de recrutement ne sont pas autorises à soumettre des CV par l'intermediaire de ce site web ou directement aux gestionnaires.
और दिखाएं"
