Job Location,Title,Company,Description
"Montreal, Quebec, Canada",Developeur senior back-end - plateformes payantes,MindGeek,"Vous travaillerez au sein d'une equipe dynamique, creative et fun dans le but d'atteindre les objectifs communs.

Ce que vous ferez:

Concevoir, elaborer et maintenir des microservices, des API et des applications bâties autour de PHP et du cadre Symfony.
Exploiter le plein potentiel de diverses technologies dorsales afin de tirer parti du traitement en pipeline en temps reel de donnees volumineuses et securisees. Travailler avec des caches, des files d'attente de messages, des bases de donnees et divers systemes internes et externes.
Favoriser l'esprit d'equipe ainsi que l'ambiance d'apprentissage et de croissance en interagissant avec les coequipiers debutants et intermediaires, en les dirigeant et en leur enseignant.
S'approprier les composants et la connaissance du domaine, guider vos pairs au moyen de demandes de tirage et de revues de code, et participer à la propagation de la culture de developpement, des processus et des valeurs partagees par l'equipe.


Ce dont vous aurez besoin pour reussir:

Competences essentielles:

Excellente connaissance de PHP 7 et 8, ainsi que des cadres recents Symfony ou Laravel
Competence et experience en matiere de conception d'architecture orientee services (SOA)
Comprehension de la complexite, de l'extensibilite et de la securite des calculs et des donnees
Bonne connaissance des modeles de conception et des algorithmes applicables
Capacite à concevoir, à bâtir et à gerer des applications et des composants efficaces


Atouts:

Experience professionnelle connexe d'au moins 3 ans en tant que Developpeur de logiciels back-end; un baccalaureat en informatique ou en genie informatique
Une experience avec Docker, ELK, RabbitMQ, Redis et GitLabCI
Connaissance de systeme de mise en cache


En tant qu'employeur souscrivant au principe de l'egalite d'acces à l'emploi, notre entreprise celebre la diversite et s'engage à creer un environnement inclusif pour tous ses employes.

Ce poste peut vous exposer à du contenu pour adultes
Lihat selengkapnya"
"Laval, Quebec, Canada",Developeur Full-Stack,Randstad Canada,"Etes vous Developpeur full stack proactif à la recherche du prochain defi dans une companie en plaine croissance situe a Laval? Cherchez-vous à joindre une equipe situe a Laval qui fournit des technologies de pointe en matiere de traitement, analyse et transmission video comme developeur Full-Stack? Cette opportunite dans une companie situe a Laval est une occasion à ne pas manquer pour tous le developeurs full-stack qui veulent à joindre une equipe tres dynamique qui va leur premettre de developper considerablement leurs competences et leurs capacites.

Avantages

Assurance telemedecine
Trois semaines de vacances
Compte de gestion Sante
Conge aniversaire
Quatre jours de conge pendant les periodes des fêtes
Cinque jours de maladie par annee
Options Stock
Horaire et mode de travail flexible
Équipe dynamique et environnement stimulant


Responsabilites

Le developeur full stack va travailler sur la partie firmware
Concevoir et developper un excellent logiciel, evolutif et robuste, puis le


faire fonctionner.

Diriger la feuille de route et la definition technique et aider l’equipe à etablir


des priorites et à planifier.

Identifier les lacunes dans les connaissances, les outils et les processus et


travailler pour les combler.

Incorporer les meilleures pratiques et habitudes de developpement.
Travailler avec des ingenieurs partageant les mêmes idees dans un


environnement agile avec des journees de demonstration, des revisions de

code, des bogues et des pics de recherche.

Developper des modules logiciels axes sur la gestion et la transmission


video en temps reel à l’aide des derniers codecs et SoC materiels.

Developper des modules logiciels embarques de haute performance qui


ciblent les environnements Linux et Windows en temps reel.

Developper des applications utilisateur interactives qui ciblent les


environnements Windows.

Developper des modules logiciels mettant en oeuvre des protocoles


logiciels specifiques (ONVIF, PTZ, etc.).

Qualifications

3+ ans d’experience en developpement de logiciels en C#, C++ et C.
Experience dans la construction et la maintenance d’API (REST).
Experience en developpement de protocole comme ONVIF, RTSP, PTZ, etc.
Experience en developpement HTML, Java Script, Angular.
Connaissance des systemes de gestion video (VMS).


Sommaire

Le rele t'interesse? N'hesite pas à appliquer et-ou à envoyer ton CV au ayad.nahas@randstad.ca

Au plaisir!

Randstad Canada s'engage à favoriser une main-d'œuvre representative de toutes les populations du Canada. Nous nous engageons en consequence à developper et à mettre en œuvre des strategies pour promouvoir l'equite, la diversite et l'inclusion dans toutes nos spheres d'activite en examinant nos politiques, pratiques et systemes internes tout au long du cycle de vie de notre main-d'œuvre, y compris au niveau du recrutement, de la retention et de l'avancement pour tout individu. En plus de notre profond engagement sur le respect des principes des droits de la personne, nous nous engageons à prendre toute mesure positive pour influer sur les changements à mettre en place en vue de garantir la participation de tout individu dans le monde du travail et ce, sans obstacle, systemique ou autre, en particulier pour les groupes en quête d'equite generalement sous-representes dans la main-d'œuvre au Canada, y compris les personnes qui s'identifient comme femmes ou personnes non-binaires-non conformes au genre, les Peuples et communautes autochtones, les personnes en situation de handicap (visible ou invisible), les personnes faisant partie des minorites visibles, les personnes racisees et des communautes LGBTQ2+.

Randstad Canada s'engage à creer et à maintenir un milieu de travail inclusif et accessible pour toutes les personnes candidates et employes en soutenant leurs besoins d'accessibilite et d'accommodation tout au long du cycle de vie de l'emploi. Nous demandons à toutes les personnes demandeuses d'emploi de bien vouloir identifier leurs besoins en matiere d'accommodation en envoyant un courriel à accessibilite@randstad.ca pour s'assurer de leur capacite à participer pleinement au processus d'entrevue.
Lihat selengkapnya"
"Laval, Quebec, Canada",Developpeur Front-end - React,Randstad Canada,"Etes vous Developpeur web front-end proactif à la recherche du prochain defi dans une companie en croissance situee a Laval? Cherchez-vous à tavailler comme developeur front-end dans une equipe situe a Laval qui fournit des technologies de pointe en matiere de traitement, analyse et transmission video ? Cette opportunite developeur front-end est une occasion à ne pas manquer pour tous les developeurs qui cherchent à joindre une companie en croissance a Laval, incluant une equipe tres dynamique qui va leur premettre de developper considerablement leurs competences et leurs capacites.

Avantages

Assurance telemedecine
Trois semaines de vacances
Compte de gestion Sante
Conge aniversaire
Quatre jours de conge pendant les periodes des fêtes
Cinque jours de maladie par annee
Options Stock
Horaire et mode de travail flexible
Équipe dynamique et environnement stimulant


Responsabilites

Participer à la definition de l’architecture et des specifications techniques des differentes interfaces utilisateurs (application, mobile et web).
Developpement d’applications clientes et des interfaces utilisateurs web utilisant des services web provenant des differents produits et-ou d’une infrastructure infonuagique.
Developpement d’outils facilitant le depannage et le debogage des diverses interfaces web mis en place.
Participer à la mise en place d’une infrastructure de CD-CI permettant une automatisation des processus de test et de livraison.
Definir les tests unitaires et-ou les tests d’integration et apporter un support à l’integration et la validation des modules
Assurer un niveau de qualite eleve des modules logiciels conçus et developpes.
Rediger la documentation technique sur les produits et solutions de l’entreprise ou maintenir la documentation existante


Qualifications

Collaborer avec des gestionnaires pour definir et comprendre leurs besoins d'affaires
Maîtriser des langages de programmation React JS et Typescript
Maîtriser le Developpement des applications de gestion


Sommaire

Le rele t'interesse? N'hesite pas à appliquer et-ou à envoyer ton CV au ayad.nahas@randstad.ca

Au plaisir!

Randstad Canada s'engage à favoriser une main-d'œuvre representative de toutes les populations du Canada. Nous nous engageons en consequence à developper et à mettre en œuvre des strategies pour promouvoir l'equite, la diversite et l'inclusion dans toutes nos spheres d'activite en examinant nos politiques, pratiques et systemes internes tout au long du cycle de vie de notre main-d'œuvre, y compris au niveau du recrutement, de la retention et de l'avancement pour tout individu. En plus de notre profond engagement sur le respect des principes des droits de la personne, nous nous engageons à prendre toute mesure positive pour influer sur les changements à mettre en place en vue de garantir la participation de tout individu dans le monde du travail et ce, sans obstacle, systemique ou autre, en particulier pour les groupes en quête d'equite generalement sous-representes dans la main-d'œuvre au Canada, y compris les personnes qui s'identifient comme femmes ou personnes non-binaires-non conformes au genre, les Peuples et communautes autochtones, les personnes en situation de handicap (visible ou invisible), les personnes faisant partie des minorites visibles, les personnes racisees et des communautes LGBTQ2+.

Randstad Canada s'engage à creer et à maintenir un milieu de travail inclusif et accessible pour toutes les personnes candidates et employes en soutenant leurs besoins d'accessibilite et d'accommodation tout au long du cycle de vie de l'emploi. Nous demandons à toutes les personnes demandeuses d'emploi de bien vouloir identifier leurs besoins en matiere d'accommodation en envoyant un courriel à accessibilite@randstad.ca pour s'assurer de leur capacite à participer pleinement au processus d'entrevue.
Lihat selengkapnya"
"Montreal, Quebec, Canada",Software Developer,Maples Group,"Position: Software Developer

Location: Montreal, Canada




About the role

You will work as part of a Scrum team to deliver software to internal and external customers of Maples Group. We work closely with fellow software engineers, testers, infrastructure engineers, products owners, scrum masters and business stakeholders to deliver products to the highest quality standards.




You will use test driven development (TDD), appropriate design patterns and SOLID principles. You will be responsible for writing unit, integration and GUI tests where appropriate. You will be responsible for peer reviewing pull requests and associated testing. You will maintain and improve the Continuous Integration and Continuous Delivery pipeline for your products. You will be expected to innovate and implement enhancements to the existing processes, technology and techniques utilized by the team.




You take responsibility as part of a team for deployments, monitoring and support of your product in production.




You will be given the opportunity to work with the latest techniques and technologies in a professional and supportive environment.




Working with Business Analysts to obtain a good understanding of the business to ensure delivering the most possible business value.
Working with the scrum team to define acceptance criteria and provide estimates for the Product Backlog.
Working with the scrum team to break down Product Backlog Items into Tasks during Sprint planning.
Working with the scrum team to develop and deliver high quality software products during a sprint cycle.
Participating in the design and development of business applications with the team.
Tracking your work in progress, reviewing the code of your teammates.
Helping the team to maintain the existing applications.




What you bring

3+ years of experience in software development using C# and .Net platform.
Have good understanding of Data structures, Algorithms, Object Oriented Design, Design Patterns and SOLID principles.
Experience developing web applications using ASP .Net MVC.
Experience developing REST APIs using frameworks like ASP .Net API.
Experience developing applications with ORM like Entity framework.
Experience implementing automated tests using MSTest or other frameworks like NUnit, xUnit, Specflow.
Experience with one or more front-end frameworks (React or Angular).
Experience with design relational databases with SQL Server or other relational databases.
Experience with responsive Web UI design using HTML5 and CSS.
Have a good understanding of DevOps concept.
Experience working with Agile using Scrum or other agile methodologies.
Experience in creating and maintaining Continuous Integration and Continuous Delivery pipelines.




Poste: Developeur de logiciels

Emplacement: Montreal, Canada




À propos du poste

Vous travaillerez au sein de l’equipe scrum pour fournir des logiciels aux clients internes et externes de Maples Group. Nous collaborons etroitement avec des collegues ingenieurs en logiciels et en infrastructures, testeurs, responsables de produit, Scrum Masters et intervenants commerciaux afin de livrer des produits qui repondent aux normes de qualite les plus elevees.




Vous aurez recours au TDD (developpements pilotes par les tests), aux modeles de conception appropries et aux principes SOLID. Vous aurez la responsabilite de rediger les tests d’unites, d’integration et d’interface graphique, au besoin. Vous vous occuperez des demandes de tirage (pull requests) d’examens par les pairs et des tests associes. Vous assurerez la maintenance et l’amelioration du pipeline d’integration continue et de livraison continue de vos produits. On s’attendra à ce que vous innoviez et apportiez des ameliorations aux processus, technologies et techniques existants utilises par l’equipe.




En tant que membre d’une equipe, vous assumez la responsabilite des deploiements, du suivi et du soutien en ce qui a trait à votre produit en production.

Vous aurez l’occasion d’utiliser les plus recentes techniques et technologies dans un milieu professionnel et positif.




Votre contribution

Travailler avec des analystes d’affaires afin d’avoir une bonne idee de l’entreprise en vue d’assurer la prestation d’une valeur operationnelle optimale.
Travailler avec l’equipe scrum pour definir les criteres d’acceptation et fournir des estimations pour le carnet de produits.
Travailler avec l’equipe scrum pour repartir les elements du carnet de produits dans les tâches lors de la planification acceleree.
Travailler avec l’equipe scrum pour developper et livrer des produits logiciels de grande qualite pendant un cycle accelere.
Participer à la conception et au developpement d’applications d’affaires avec l’equipe.
Effectuer le suivi de vos travaux en cours et reviser le code de vos coequipiers.
Aider l’equipe à assurer la maintenance des applications existantes.
3+ ans d’experience dans le developpement de logiciels avec l’utilisation des plateformes C# et .Net.
Bonne comprehension des structures de donnees, des algorithmes, de la conception orientee objet, des modeles de conception et des principes SOLID.
Experience dans le developpement d’applications Web avec ASP .Net MVC.
Experience dans le developpement d’API REST à l’aide de cadriciels comme l’API ASP .Net.
Experience dans le developpement d’applications avec un cadriciel d’entites de type ORM (modelisation de reles d’objets).
Experience dans la mise en œuvre de tests automatises au moyen de MSTest ou d’autres cadriciels comme NUnit, xUnit, Specflow.
Experience avec un ou plusieurs cadriciels frontaux (React ou Angular).
Experience dans la conception de bases de donnees relationnelles avec SQL Server ou d’autres bases de donnees relationnelles.
Experience dans la conception d’interfaces utilisateur Web receptives avec HTML5 et CSS.
Bonne comprehension du concept DevOps.
Experience dans le developpement Agile avec Scrum ou d’autres methodes agiles.
Experience dans la creation et le maintien de pipelines d’integration continue et de livraison continue.




Avantages sociaux et recompenses

Les relations professionnelles les plus durables sont les relations reciproques. Le Groupe Maples accorde la priorite à la sante et au bien-être des employes. Selon votre lieu de residence, nous vous offrons une gamme d’avantages sociaux, notamment :

une protection complete en matiere de sante (soins medicaux, soins dentaires et soins de la vue);
des offres de vacances competitives;
des programmes d’aide à l’education et de perfectionnement professionnel;
un regime de retraite ou d’epargne;
une assurance vie;
une assurance voyage;
un programme global de bien-être mental;
des clubs sportifs et des activites sociales.

Mehr anzeigen"
"Montreal, Quebec, Canada",Java Software Developer,Intrado Life & Safety,"Job Donnee

For this opening we will consider candidates from the following locations: ,QC,Canada | Montreal,QC,Canada

Developeur de logiciels

Dans le cadre de la division des services d’urgence de Intrado, notre equipe developpe et maintient une solution pour acheminer les appels d’urgence de type voix sur IP au centre d’appel approprie. La solution est composee de deux different produits (SaaS et hosted) utilisant differentes technologies. Nous cherchons une personne qui travaillera principalement (mais pas uniquement) sur les portails web de nos produits.

Nous sommes une equipe Agile experimentee et bien etablie qui utilise Scrum depuis plusieurs annees. Nous sommes à la recherche d’une personne motivee et dynamique pour se joindre à nous.

Que vous soyez un Developpeur de logiciels experimente ou encore quelqu’un avec moins d’experience, si vous recherchez des defis techniques interessants dans une atmosphere amicale et pleine d’entraide, nous sommes interesses à vous entendre!

Au sein de l’equipe de developpement, vous participerez à toutes les etapes de developpement dans un environnement tres dynamique où nous faisons plusieurs releases par annee.

Education

Un dipleme universitaire d’un etablissement agree en sciences de l’informatique, genie informatique ou dans un domaine connexe. Une experience professionnelle equivalente dans un poste similaire peut remplacer l’exigence en matiere d’education.

Exigences techniques

Solide connaissance de la programmation oriente-objet

Experience avec Ruby on Rails, Java, Javascript, SQL et Linux

Connaissance de C# et PHP est un atout

Experience en reseautique et VOIP est un atout

Connaissance de SOAP-REST est un atout

Autres exigences

Parler et ecrire couramment en français et anglais.

Intrado’s Life & Safety group in Montreal is hiring a Java Developer to join our technology team!

As part of the Life and Safety division, our team is developing and maintaining a solution to route VOIP emergency calls to the proper public safety answering point. The solution uses two different products (SaaS and hosted) using different technologies. Our team is looking for someone who will participate to the development of those products.

We are an experienced and well-established Agile team using Scrum for many years now looking for a motivated and energetic person to join us.

That you be an experienced software developer or a more junior one, if you are looking for interesting technical challenges within a friendly and cooperative team, we are interested to speak to you!

As part of the team, you will be involved in all steps of the software development in a fast-paced development cycle (several releases a year)

Minimum Requirements

Education

Degree from an accredited college or university in computer science, computer engineering or a related field required. Equivalent work experience in a similar position may be substituted for educational requirements.

Technical Skills

Solid understanding of object-oriented programming

Experience with Java, Javascript, SQL and Linux

Experience on AWS an asset

Exposure to C# and PHP is an asset

Experience in VOIP and networking is an asset

Knowledge of SOAP-REST and asset

Other

Proficient spoken and written in French and English required

Benefits & Compensation

Want to love where you work? At Intrado, we offer a comprehensive benefits package that includes what you’d expect (medical, dental, vision, life and disability coverage, paid time off, and several that go above and beyond – tuition reimbursement paid parental leave, access to a robust library of personal and professional training resources, employee discounts, critical illness, hospital indemnity and pet insurances, identity protection and more! Apply today to join us in work worth doing!
Show more"
