Job Location,Title,Company,Description
"Montreal, Quebec, Canada",PHP - Developpeur - Plateforme de Partage Video,MindGeek,"En tant que Developpeur PHP, vous aurez l'occasion de mettre sur pied certains des sites Web les plus visites au monde, de travailler avec des megadonnees et de repousser vos limites en vous familiarisant avec de nouvelles technologies et en collaborant avec certains des Developpeurs les plus talentueux.

Ce que vous ferez :

Concevoir et tenir à jour des microservices, des API et des applications bâties autour du langage PHP et d'un cadre Symfony.
Exploiter le plein potentiel de diverses technologies dorsales afin de tirer parti du traitement en pipeline en temps reel de megadonnees securisees.
Travailler avec des caches, des files d'attente de messages, des bases de donnees et divers systemes internes et externes.
Assimiler les connaissances sur les composants et les domaines en guidant vos pairs au moyen de demandes de retrait et de revues de code. Participer à la propagation de la culture, des processus et des valeurs de developpement partages par l'equipe.


Ce dont vous aurez besoin pour reussir :

Competences essentielles :

Au moins 3 ans d'experience professionnelle connexe en tant que Developpeur de logiciels dorsaux
Baccalaureat en informatique-en ingenierie (atout)
Excellente connaissance d'un langage Web (PHP, Java Web, Python, GO, etc.)
Comprehension de la complexite, de l'extensibilite et de la securite des calculs et des donnees


Atouts :

Experience du langage PHP et d'un cadre (Lumen, Yii, Laravel, Symfony, etc.)
Experience avec Docker, ELK, RabbitMQ, Redis et GitLabCI
Connaissance approfondie des technologies de base de donnees permettant de faire evoluer les sites Web à fort volume (Redis, Memcached)
Experience de la gestion de sites Web de grande envergure recevant des millions de visites par jour


En tant qu'employeur souscrivant au principe de l'egalite d'acces à l'emploi, notre entreprise celebre la diversite et s'engage à creer un environnement inclusif pour tous ses employes.

Ce poste peut vous exposer à du contenu pour adultes.
Daha fazla göster"
"Montreal, Quebec, Canada",Developpeur Intermediaire - Intermediate Developer,L'Atelier Animation Inc.,"Donnee de l’entreprise:




L’Atelier Animation est un studio specialise dans la fabrication de series et de longs metrages d'animation en images de synthese.




Établie à Montreal depuis 2012, l'Atelier se demarque par le choix de ses projets d'envergure et par son infrastructure technologique en constante amelioration.




Veritable lieu de creativite, le studio privilegie le talent et l'audace en s'entourant d'artistes, de techniciens et de gestionnaires passionnes.




Donnee du poste :




Sous la supervision du Directeur R&D, le Developpeur est responsable de creer et maintenir les librairies necessaires à notre pipeline et nos outils.




Le poste requiert de solides competences en developpement de pipeline avec une capacite à elaborer du code efficace, robuste, facile à maintenir et facile pour les utilisateurs.




Responsabilites :




Developper, creer et soutenir de nouveaux flux de travail ainsi que ceux dejà existants.
Optimiser, entretenir et moderniser le pipeline du studio en developpant et en maintenant un code efficace.
Coder, deployer, tester, maintenir et documenter les API et l’infrastructure.
Aider à depanner, analyser et reparer les problematiques des outils de pipeline - front-end existants.
Modifier et prolonger l’existence des outils de pipeline afin qu’ils prennent en charge les nouveaux flux de travail, conception de nouveaux systemes ou optimisation des fonctionnalites existantes.
Maintenir une bonne entente et une bonne dynamique d’equipe.




Competences exigees :




3+ ans d'experience souhaitee.
De solides competences en programmation Python sont requises.
Familier avec les differents DCC-logiciels utilises dans l’industrie (Maya, Nuke, etc).
Connaissance de Qt-PySide est un plus.
Une connaissance des tests logiciels (par exemple: tests unitaires, tests d'integration, etc.) est un plus.
Excellentes competences en matiere de depannage et de debogage.
Capacite averee à travailler de façon autonome et en equipe.
Proactif, tres motive et desireux de travailler avec les dernieres technologies.
Bonne connaissance pratique de Linux, de preference.
Connaissance d'Autodesk ShotGrid et experience en programmation est un plus.
L'orientation professionnelle vers l'industrie des effets visuels est un plus.
Capacite et interêt à acquerir de nouvelles competences de maniere autonome hautement souhaites.
Connaissance du langage de programmation C++ est un plus.
Maîtrise du français et-ou de l'anglais, parle et ecrit.




Titre du poste: Developpeur Intermediaire




Statut: Temps plein permanent




Lieu de travail: Montreal




Entree en poste : ASAP




Salaire annuel: En fonction de l’experience




Company Donnee:




L’Atelier Animation is an animation studio that specializes in the creation of 3D feature films and television series.




Founded in Montreal in 2012, L'Atelier has distinguished itself by its choice of highly creative projects to work on and its constantly evolving technological infrastructure.




At its core, L'Atelier is a place of creativity, and the studio prides itself on the talent and audacity of all its passionate artists, technicians and managers.




Job Donnee :




Under the supervision of the Head of R&D, the Developer is responsible for creating and maintaining the necessary libraries for our pipeline and tools.




This position requires strong knowledge in pipeline development with the ability to elaborate an efficient, solid, user-friendly and easy-to-maintain code base.




Responsibilities :




Develop, create and support new and existing pipeline initiatives and workflows.
Optimize, keep relevant and modernize the studio's pipeline by writing and maintaining efficient code.
Code, deploy, test, maintain and document new and existing APIs and frameworks.
Help troubleshoot, analyze and repair issues in current pipeline-front-end tools.
Modify and extend existing pipeline tools to accommodate new workflows, take better advantage of new systems or optimize existing functionality.




Qualifications :




3+ years experience.
Strong Python programming skills are required.
Familiar with the different DDC-software used in the industry (ex. Maya, Nuke, etc.)
Qt-PySide knowledge is a plus.
Familiarity with software testing (e.g. unit testing, integration testing, etc) is a plus.
Excellent troubleshooting and debugging skills.
Proven ability to work independently and in a team setting.
Proactive, highly motivated and eager to work with the latest technologies.
Strong working knowledge of Linux is preferred.
Autodesk ShotGrid knowledge and programming experience is a plus.
Career focus for the visual effects industry is a must.
Ability and interest in learning new skills autonomously are highly desired.
Knowledge of the C++ programming language is a plus.
Proficient in French and-or English, spoken and written.




Job Title: Intermediate Developer




Status: Full-time, permanent




Place of work: Montreal




Start date: ASAP




Annual Salary: Experience-based




Powered by JazzHR




duiYR7Gpp5
और दिखाएं"
"Montreal, Quebec, Canada",Developpeur - Developpeuse full stack,Alborea,"Groupe Alborea




Situe dans le cœur du Mile-End à Montreal, Alborea est une entreprise specialisee dans le developpement d'applications Web à usage industrielles.




Le poste - En Bref




Poste permanent à temps plein (37.5-semaine). La personne retenue participera concretement à la conception, la realisation et le deploiement en suivant les dernieres tendances logicielles, visuelles et technologiques. Elle sera amenee à mettre à profit ses competences en developpement applicatif Web en etroite collaboration avec les charges de projets et le reste de l'equipe de developpement logiciel.




La personne ideale aura des competences en gestion de projets et d’equipe, sera autonome, creative, sensible aux details, curieuse et animee à explorer de nouvelles tendances, pistes et solutions.




Les responsabilites




Communiquer et collaborer de maniere constante avec le reste de l'equipe de developpement logiciel et ses charges de projets;
Creer des applications Web modernes, autant client que serveur;
Ameliorer les performances et maintenir nos applications Web actuelles;
Concevoir des interfaces utilisateurs adaptatives (responsive design) suivant les normes;
Concevoir et mettre en place des strategies de tests.




Les connaissances requises




Diplemes d'etudes en developpement d'applications (Collegial ou universitaire) ou experiences equivalentes;
Minimum 5 ans d'experience dans le domaine);
Solides competences avec Angular (actuellement version 8.x) ou autres clients (React, Vue.js);
Maîtrise de JavaScript, HTML, CSS et Node.js;
Connaissances de PostgreSQL;
Connaissances de tests sur le Web (Protractor);
Pratique de developpement Agile;
Bonnes aptitudes de communications et rigueur.




Seront Juges Comme Des Atouts




Experience de developpement dans le milieu industriel;
Experience avec les frameworks serveur LoopBack (3.x ou 4.x)
Connaissances de DigitalOcean, AWS, IBM Cloud;
Bilinguisme (Français - Anglais).




Les avantages que nous offrons et ce qui nous distingue




C’est notre equipe, notre vision, notre authenticite et nos competences. Chez nous, on carbure au depassement et à l’ingeniosite. On celebre les realisations. On cultive la fierte. La hierarchie, tres peu pour nous : on valorise le talent au lieu des titres. On aligne nos passions avec nos realisations. Ça vous parle ?




De plus, cela comprend une couverture d’assurances collectives, un regime de retraite, une allocation si vous pratiquez du sport, une equipe dynamique et visionnaire.




Faites parvenir une lettre de motivation et votre curriculum vitae à notre Service des ressources humaines à l’adresse suivante rh@alphard.com.




L’usage du masculin est utilise à des fins d’allegement de texte sans aucune discrimination. L’entreprise souscrit au principe d’equite en matiere d’emploi. Le poste est ouvert à tous les candidats repondant aux criteres specifies.
Daha fazla göster"
"Montreal, Quebec, Canada",Software Developer - Developpeur logiciel - Computer Vision,Genetec,"The team:

Working in Genetec’s AutoVu division is a chance to immerse yourself in an extremely interdisciplinary environment. Software developers (both embedded and cloud), hardware engineers and technicians, mechanical designers, specialists in deep neural networks, computer vision, and production, work together to develop a range of innovative products. Be part of an ecosystem where collaboration is the watchword, made up of specialists always on the lookout for scientific and technological discoveries.

You can be part of a multidisciplinary team of computer vision-machine learning specialists and software developers. The team collaborates on the development of intelligent vehicle centric cameras in optical, image acquisition control and machine learning aspects. We have built an infrastructure of cloud tools that allow to acquire, store, generate, manage a very large amount of data and to monitor cameras. These are the essential tools for the neural networks and data science functionalities development.

Genetec is looking for an experienced developer in video or image processing to join the research and development team.

What your day will look like:

You will be responsible to develop, test and integrate video processing algorithms (low level control of camera, diffusion and management of video stream, intelligent analysis of video, real time transformation of video stream, etc.) and image processing algorithms in Genetec products
You will participate to the acceleration of the algorithms that run real time, taking advantage of the possibilities of our processors and coprocessors
You will design automated tests and modernize existing code
You will evaluate the system components, recommend possible alternative (including newer technologies) and then implement, test and evaluate changes
You will propose, test, develop and evaluate proofs of concepts and prototypes for new generations of products; propose new products and-or solutions to enlarge existing product line


About you:

Bachelor's degree in computer engineering, computer science, electrical engineering, physics or mathematics
A minimum of three years of experience in object-oriented programming
A minimum of three years of experience in image or video processing
Strong ability to conduct experimental and hands-on research
A strong sense of initiative


Technical Requirements:

Mastering an object language: C #, C ++, Java
Ability to recognize, analyze and integrate new technologies into the development of new products
Knowledge of different software development methods and procedures
Excellent technical and communication skills


Great if you have:

Knowledge in build pipelines
Knowledge of concurrent and async (thread pools, async await)
Knowledge of embedded programming
Experience with containerization technologies such as Docker and Kubernetes
Experience in Linux


Let's talk perks!

Attractive compensation package
Training Tuition Reimbursement Program
Subsidized meals in our amazing Bistro (Les Cordons Bleus)
Work-life balance with a flexible working schedule
Free, unlimited coffee
Private, free parking for all employees
Onsite fitness facility with personal trainer


Would you like to know what it looks like to work at Genetec? Click on the following link to find out for yourself! Genetec Culture

L'equipe

Travailler dans la division AutoVu de Genetec c’est avoir la chance de baigner dans un milieu extrêmement multidisciplinaire. Des equipes de Developpeurs en programmation embarquee, infonuagique, firmware, des ingenieurs et techniciens hardware, des designers mecaniques, des specialistes en reseaux neuronaux, en imagerie et en mise en production, collaborent pour developper une gamme de produits innovants. Faites partie d’un ecosysteme dans lequel la collaboration est le mot d’ordre, compose de specialistes toujours à l’affût des decouvertes scientifiques et technologiques.

Vous pourriez faire partie d’une equipe multidisciplinaire de specialistes en vision numerique, en apprentissage machine et en developpement logiciel. Le developpement logiciel est autant embarque qu’infonuagique. L’equipe collabore au developpement de cameras intelligentes, tant dans les aspects optiques, de contrele d’acquisition d’images que de developpement d’analytiques centres sur les vehicules. Nous avons bâti une infrastructure d’outils infonuagiques qui permettent d’acquerir, stocker, generer et gerer un tres grand nombre de donnees ainsi que monitorer des cameras. Ce sont les outils essentiels au developpement de reseaux neuronaux et d’outils en science des donnees.

Genetec est à la recherche d’un Developpeur experimente traitement video ou en traitement d’images pour se joindre à l’equipe de recherche et developpement.

À quoi ressemblera votre journee:

Vous serez responsable de developper, tester et integrer des algorithmes de traitement video (contrele bas niveau de camera, diffusion et gestion de flux video, analyse intelligente de la video, transformation de flux video en temps reel, etc.) et de traitement d’images dans les produits Genetec
Vous participerez à l’acceleration de nos algorithmes roulant en temps reel en profitant des possibilites des processeurs et coprocesseurs
Vous concevrez des tests automatises, et moderniserez du code existant
Vous evaluerez les composantes des systemes actuels, recommanderez des alternatives possibles (en incluant les nouvelles technologies) ainsi qu’implementer, tester et evaluer les changements
Vous devrez aussi proposer, tester, developper et evaluer les concepts et prototypes pour les nouvelles generations de produits; proposer de nouveaux produits et-ou solutions en vue d’elargir la gamme de produits existants


Votre profil:

Baccalaureat en genie informatique, science informatique, genie electrique, physique ou en mathematiques
Un minimum de trois annees d’experience en programmation objet
Un minimum de trois annees d’experience en traitement d’images ou video
De fortes capacites à effectuer des recherches experimentales et pratiques
Un grand sens de l’initiative


Expertise technique:

Maitrise d’un langage objet : C#, C++, Java
Habilete à reconnaître, analyser et integrer de nouvelles technologies dans le developpement de nouveaux produits
Connaissance des differentes methodes et procedures de developpement de logiciels
Possede d’excellentes aptitudes techniques et de communication


Encore mieux si vous possedez ces atouts:

Connaissance des pipelines de build
Connaissances en programmation concurrente et asynchrone (thread pools, async await)
Connaissance de la programmation embarquee
Experience avec les technologies de conteneurisation telles que Docker et Kubernetes
Experience en Linux


Voilà ce que nous offrons!

Regime de remuneration attrayant
Programme de remboursement des frais de formation
Repas subventionnes à notre incroyable Bistro (Les Cordons Bleus)
Équilibre entre vie professionnelle et vie privee grâce à un horaire de travail flexible
Cafe gratuit à volonte
Espace de stationnement gratuit pour tous les employes
Centre d’entraînement sur place


Si vous souhaitez savoir à quoi ressemble l’environnement de travail chez Genetec, voici le lien vers notre video d’entreprise: Culture à Genetec
और दिखाएं"
"Montreal, Quebec, Canada",Developpeur de logiciels Java,MindGeek,"En tant que Developpeur Java au sein de l'equipe Atlas, vous aurez l'occasion de travailler sur une vaste plateforme financiere et de referencement de webmestres qui sert des centaines de milliers d'affilies et de partenaires. Ayez la chance de faire partie d'une equipe forte et dynamique qui prene le travail d'equipe et qui aime resoudre ensemble des problemes complexes.

Ce que vous ferez :

Élaborer, creer et mettre à jour des applications dorsales orientees objet.
Effectuer l'examen du code et determiner des recommandations d'adaptation.
Analyser et documenter les processus.


Ce dont vous aurez besoin pour reussir :

Competences essentielles :

Au moins 5 ans d'experience dans un poste similaire
Solide connaissance de Java
Experience avec Spring, Hibernate et Spring Batch
Experience des environnements infonuagiques : GCP, AWS et Azure
Experience du developpement et de l'exploitation (DevOps), des outils d'integration et de livraison continues (CI-CD), de Gitlab, de Jenkins, de Bamboo (facultatif), de Docker et de GKE
Experience avec le cadre JS conventionnel Angular-ReactJS-etc.
Experience en segmentation de processus
Connaissance intermediaire des systemes bases sur Unix
Capacite à travailler de façon autonome et en equipe
Capacite à faire face à des priorites techniques en constante evolution


Atouts :

Experience avec les systemes de gestion de base de donnees relationnelle (SGBDR), PostgreSQL et Pooling
Experience avec les systemes de cache, Redis
Experience avec les files d'attente de messages, RabbitMQ-SQS-Pub Sub
Experience avec Hibernate
Experience avec Elasticsearch
Experience des plateformes de distribution publicitaire
Experience des plateformes de traitement des paiements
Baccalaureat en informatique


En tant qu'employeur souscrivant au principe de l'egalite d'acces à l'emploi, notre entreprise celebre la diversite et s'engage à creer un environnement inclusif pour tous ses employes.

Ce poste peut vous exposer à du contenu pour adultes.

Le masculin est utilise dans le seul but d'alleger le texte.
और दिखाएं"
"Montreal, Quebec, Canada",Developpeur ORACLE,TEHORA inc.,"TEHORA est presentement à la recherche d’un collaborateur Developpeur ORACLE ayant d’excellentes aptitudes techniques, d’excellentes connaissances et qui souhaite mettre à profit ses competences au sein d’une equipe polyvalente.

Principales Responsabilites

Proceder à la realisation technique, notamment la programmation des unites de tâches ou des modules (principalement avec APEX);
Faire des procedures, des fonctions, des packages, etc. à l’aide de PL-SQL Developer ;
Participer à la programmation dans le cadre des travaux de la migration Oracle de la version 10g à 19c;
Realiser les essais unitaires des programmes informatiques à partir des specifications fournies par les analystes fonctionnels;
Supporter les analystes dans le cadre des essais fonctionnels;
Supporter les utilisateurs dans le cadre des essais d’acceptation;
Effectuer le transfert de connaissance.


Requirements

Posseder trois (3) ans d’ex­perience en TI à titre de pro­grammeur avec une bonne maitrise de APEX
Avoir un DEC en technologies de l’information
Faire preuve d’une grande capacite d’autonomie ;
Avoir une maîtrise des bonnes pratiques courantes en matiere de programmation ;
Faire preuve de creativite et d’adaptabilite lors de recherche de solutions ;
Connaissance des outils de developpement en APEX, PL-SQL, Oracle versions 10 et +, BIRT Reporting, Oracle Forms et Reports, REACT, JAVASCRIPT, PHP.


TEHORA applique un programme d’acces à l’egalite et invite les femmes, les minorites visibles, les Autochtones et les personnes handicapees à presenter leur candidature.

Benefits

Lieu de travail

Le lieu de travail est hybride: en tele-travail et sur site.

Pourquoi se joindre à TEHORA ?

TEHORA se distingue par sa culture d’entreprise, axee sur le bonheur de ses employes et la diversite. Chez TEHORA, chaque collaborateur est un membre important de l'equipe qui contribue à notre succes collectif. Nos membres ont la flexibilite requise pour avoir un equilibre entre le travail et leur vie privee, tout en menant une carriere enrichissante.

Nous offrons un environnement de travail motivant. La diversite des projets, la grande autonomie et l’interaction directe avec les clients sont appreciees. Une telle proximite est possible en raison de notre structure organisationnelle horizontale, qui se traduit par des relations de confiance et une communication efficace entre notre equipe et les clients.

Avantages

Du teletravail et de la flexibilite pour s’adapter à vos obligations familiales
Un programme d’assurance collective complete
Un REER collectif avec une contribution de l’employeur
Couverture d'assurance collective flexible
Conges en cas de maladie et à l'occasion d'evenements familiaux
Outils informatiques adaptes
Espace de travail epanouissant et motivant.
Initiatives sociales et environnementales
Programme d’apprentissage en milieu de travail


Salaire

Le salaire sera calculer sur la base du taux horaire moyen correspondant à votre profil.
Daha fazla göster"
